id,title,description,courseId
cmghb64zy000e4yud9pcjtlab,Cell Structure Quiz,Identify and describe major organelles in a eukaryotic cell.,cmghb633r00034yudqkjerbek
cmghb656v000g4yudbesg83zo,Derivative Practice,Compute derivatives of polynomial and exponential functions.,cmghb630w00024yudvmv5qwe1
cmghb65g2000i4yudl21ppd2z,Photosynthesis Essay,Explain the steps and importance of photosynthesis.,cmghb633r00034yudqkjerbek
cmghb65n8000k4yud9gh4et18,Sorting Algorithms,Implement and compare bubble sort and quicksort.,cmghb62q100004yudg6p4rx74
cmghb65u4000m4yuda1mm4f3l,WWII Timeline,Create a timeline of key WWII events and their significance.,cmghb639o00044yudxcfro39h
cmghb666l000o4yudnapqigl4,Analyzing Hamlet,Discuss the theme of madness in Shakespeare's 'Hamlet'.,cmghb62yl00014yud2t9f9rxi