id,title,description,instructorId
cmghb62q100004yudg6p4rx74,Computer Science Basics,"Intro to programming, algorithms, and data structures.",cmghb63jk00064yudty69i7bf
cmghb62yl00014yud2t9f9rxi,World Literature,Study of major literary works across cultures and eras.,cmghb63el00054yud1s54bzid
cmghb630w00024yudvmv5qwe1,Calculus I,Differential calculus with applications to real-world problems.,cmghb63jk00064yudty69i7bf
cmghb633r00034yudqkjerbek,Biology 101,"Intro to Biology: cells, genetics, ecology, evolution.",cmghb63el00054yud1s54bzid
cmghb639o00044yudxcfro39h,Modern History,History of the modern world from 1900 onward.,cmghb6423000a4yuda219t4mg